"Chat","Date","Time","Sender","Message","StartLine"
"Jordi personal","2025-06-10","17:23","Meriem","Hola Jordi, estic validant totes les imatges que mhas anat dient i canviant versions. N'hi ha una k crec k es per això k no la veus bé.  En principi quan t'hi posis totes les que t'he contestat haurien d'estar bé. Qualsevol cosa k vegis chat perk tu modifiqui rn aquell moment. Es igual l'hora. Merci","867"
"Jordi personal","2025-06-10","17:37","Meriem","Diria que ja està tot ok","868"
"Jordi personal","2025-06-10","17:37","Jordi Català","👌🙏","869"
"Jordi personal","2025-06-10","17:40","Meriem","Qualsevol cosa me dius! Merci","870"
"Jordi personal","2025-06-10","17:41","Jordi Català","👍 gràcies!","871"
